{
  "_ncp": 1,
  "type": "task_list",
  "schema_version": 1,
  "plan_id": "plan-cloverthe.ai-20260424-123456",
  "version_id": 1,
  "created_at": "2026-04-24T12:45:00Z",
  "created_by": "urn:nps:agent:cloverthe.ai:decomposer-clover",
  "prior_version": null,
  "pushback_reason": null,
  "dag": {
    "nodes": [
      {
        "id": "node-1",
        "action": "research-login-flow",
        "agent": "urn:nps:agent:cloverthe.ai:researcher-01",
        "input_from": [],
        "input_mapping": {},
        "scope": ["src/auth/**", "docs/auth.md"],
        "budget_npt": 8000,
        "timeout_ms": 600000,
        "retry_policy": { "max_retries": 1, "backoff_ms": 5000 },
        "condition": null,
        "success_criteria": {
          "files_touched": ["docs/auth-flow.md"],
          "tests": []
        }
      },
      {
        "id": "node-2",
        "action": "refactor-login-handler",
        "agent": "urn:nps:agent:cloverthe.ai:coder-01",
        "input_from": ["node-1"],
        "input_mapping": { "research_doc": "node-1.files_touched[0]" },
        "scope": ["src/auth/login.ts", "src/auth/__tests__/**"],
        "budget_npt": 15000,
        "timeout_ms": 1200000,
        "retry_policy": { "max_retries": 1, "backoff_ms": 5000 },
        "condition": null,
        "success_criteria": {
          "commits": "≥1",
          "tests": ["login.test.ts"]
        }
      }
    ],
    "edges": [
      { "from": "node-1", "to": "node-2" }
    ]
  }
}
